{
  "schema_version": "ebm-audit-scenario-derivation-registry/2.3",
  "digest_state": "PERSISTED",
  "substantive_evidence_schema_path": "schemas/scenario-evidence.schema.json",
  "payload_schema_path": "schemas/scenario-family-payload.schema.json",
  "derivation_semantics": {
    "semantics_version": "scenario-derivation-semantics/5",
    "normative_document": "docs/spec/scenario-derivation-semantics.md",
    "vector_order": {
      "case_vectors": "PUBLIC_BATCH_CASE_PLAN_CASE_ORDINAL_ORDER",
      "comparator_vectors": "COMPARATOR_PLAN_MEMBER_THEN_REPLICATE_ORDER",
      "subtype_vectors": "PROPORTIONAL_OPERATION_PLAN_CASE_ORDINAL_ORDER",
      "boundary_rule_vectors": ["boundary_q50", "boundary_q35", "boundary_q65"],
      "pair_vectors": "DERIVATION_SPECIFIC_ORDER",
      "order_rule_states": ["KNOWN_TRUTH_ORDER_FAMILY_STATE"],
      "stage_rule_states": ["KNOWN_TRUTH_STAGE_FAMILY_STATE"],
      "moderate_rule_states": ["reference_alignment", "paired_randomization", "signal_stage_mae", "convergence"],
      "noise_ladder_rule_states": ["SPEARMAN_FAMILY_STATE"],
      "influence_rule_states": ["INJECTED_PARTICIPANT_STRICT_MAJORITY_FAMILY_STATE"]
    },
    "bindings": [
      {"derivation_id":"actual-complete-case-removals/1","normative_anchor":"#actual-complete-case-removals-1","semantic_status":"FROZEN"},
      {"derivation_id":"analysis-rule-identities/1","normative_anchor":"#analysis-rule-identities-1","semantic_status":"FROZEN"},
      {"derivation_id":"backend-nonfinite-admission-flag/1","normative_anchor":"#backend-nonfinite-admission-flag-1","semantic_status":"FROZEN"},
      {"derivation_id":"block-aware-scoring-flag/1","normative_anchor":"#block-aware-scoring-flag-1","semantic_status":"FROZEN"},
      {"derivation_id":"false-positive-qualification-state/2","normative_anchor":"#false-positive-qualification-state-2","semantic_status":"FROZEN"},
      {"derivation_id":"complete-preprocessing-refit-equality/1","normative_anchor":"#complete-preprocessing-refit-equality-1","semantic_status":"FROZEN"},
      {"derivation_id":"declared-contamination-fraction/1","normative_anchor":"#declared-contamination-fraction-1","semantic_status":"FROZEN"},
      {"derivation_id":"forbidden-report-claim-flag/1","normative_anchor":"#forbidden-report-claim-flag-1","semantic_status":"FROZEN"},
      {"derivation_id":"null-family-denominator-exclusion/2","normative_anchor":"#null-family-denominator-exclusion-2","semantic_status":"FROZEN"},
      {"derivation_id":"group-count-accounting-equality/1","normative_anchor":"#group-count-accounting-equality-1","semantic_status":"FROZEN"},
      {"derivation_id":"group-count-preservation/1","normative_anchor":"#group-count-preservation-1","semantic_status":"FROZEN"},
      {"derivation_id":"group-marginal-preservation/1","normative_anchor":"#group-marginal-preservation-1","semantic_status":"FROZEN"},
      {"derivation_id":"hidden-imputation-flag/1","normative_anchor":"#hidden-imputation-flag-1","semantic_status":"FROZEN"},
      {"derivation_id":"hidden-modification-flag/1","normative_anchor":"#hidden-modification-flag-1","semantic_status":"FROZEN"},
      {"derivation_id":"ineligible-strong-evidence-flag/1","normative_anchor":"#ineligible-strong-evidence-flag-1","semantic_status":"FROZEN"},
      {"derivation_id":"influence-rule-state/1","normative_anchor":"#influence-rule-state-1","semantic_status":"FROZEN"},
      {"derivation_id":"internal-concentration-flag/1","normative_anchor":"#internal-concentration-flag-1","semantic_status":"FROZEN"},
      {"derivation_id":"known-truth-order-rule-state/1","normative_anchor":"#known-truth-order-rule-state-1","semantic_status":"FROZEN"},
      {"derivation_id":"known-truth-stage-rule-state/1","normative_anchor":"#known-truth-stage-rule-state-1","semantic_status":"FROZEN"},
      {"derivation_id":"label-manifest-equality/1","normative_anchor":"#label-manifest-equality-1","semantic_status":"FROZEN"},
      {"derivation_id":"matched-cross-chain-delta/1","normative_anchor":"#matched-cross-chain-delta-1","semantic_status":"FROZEN"},
      {"derivation_id":"matched-entropy-delta/1","normative_anchor":"#matched-entropy-delta-1","semantic_status":"FROZEN"},
      {"derivation_id":"matched-kendall-agreement/1","normative_anchor":"#matched-kendall-agreement-1","semantic_status":"FROZEN"},
      {"derivation_id":"matched-kendall-delta/1","normative_anchor":"#matched-kendall-delta-1","semantic_status":"FROZEN"},
      {"derivation_id":"matched-position-entropy/1","normative_anchor":"#matched-position-entropy-1","semantic_status":"FROZEN"},
      {"derivation_id":"missing-count-equality/1","normative_anchor":"#missing-count-equality-1","semantic_status":"FROZEN"},
      {"derivation_id":"missing-count-preservation/1","normative_anchor":"#missing-count-preservation-1","semantic_status":"FROZEN"},
      {"derivation_id":"missingness-mask-digest-equality/1","normative_anchor":"#missingness-mask-digest-equality-1","semantic_status":"FROZEN"},
      {"derivation_id":"moderate-matched-null-rule-state/1","normative_anchor":"#moderate-matched-null-rule-state-1","semantic_status":"FROZEN"},
      {"derivation_id":"noise-ladder-monotonic-rule-state/1","normative_anchor":"#noise-ladder-monotonic-rule-state-1","semantic_status":"FROZEN"},
      {"derivation_id":"nonfinite-admission-flag/1","normative_anchor":"#nonfinite-admission-flag-1","semantic_status":"FROZEN"},
      {"derivation_id":"null-source-binding-equality/1","normative_anchor":"#null-source-binding-equality-1","semantic_status":"FROZEN"},
      {"derivation_id":"opposing-pair-absolute-precedence-from-half/1","normative_anchor":"#opposing-pair-absolute-precedence-from-half-1","semantic_status":"FROZEN"},
      {"derivation_id":"participant-event-alignment-change/1","normative_anchor":"#participant-event-alignment-change-1","semantic_status":"FROZEN"},
      {"derivation_id":"partial-truth-scoring-without-tiebreak/1","normative_anchor":"#partial-truth-scoring-without-tiebreak-1","semantic_status":"FROZEN"},
      {"derivation_id":"prebackend-terminal-contract/1","normative_anchor":"#prebackend-terminal-contract-1","semantic_status":"FROZEN"},
      {"derivation_id":"predicted-complete-case-removals/1","normative_anchor":"#predicted-complete-case-removals-1","semantic_status":"FROZEN"},
      {"derivation_id":"reference-only-preprocessing-fit/1","normative_anchor":"#reference-only-preprocessing-fit-1","semantic_status":"FROZEN"},
      {"derivation_id":"report-decision-attribution/1","normative_anchor":"#report-decision-attribution-1","semantic_status":"FROZEN"},
      {"derivation_id":"required-report-claim-flag/1","normative_anchor":"#required-report-claim-flag-1","semantic_status":"FROZEN"},
      {"derivation_id":"resample-leakage-count/1","normative_anchor":"#resample-leakage-count-1","semantic_status":"FROZEN"},
      {"derivation_id":"selected-threshold-flag/1","normative_anchor":"#selected-threshold-flag-1","semantic_status":"FROZEN"},
      {"derivation_id":"silent-row-loss-flag/1","normative_anchor":"#silent-row-loss-flag-1","semantic_status":"FROZEN"},
      {"derivation_id":"stronger-than-null-flag/1","normative_anchor":"#stronger-than-null-flag-1","semantic_status":"FROZEN"},
      {"derivation_id":"subtype-case-identities/1","normative_anchor":"#subtype-case-identities-1","semantic_status":"FROZEN"},
      {"derivation_id":"suppressed-warning-flag/1","normative_anchor":"#suppressed-warning-flag-1","semantic_status":"FROZEN"},
      {"derivation_id":"terminal-contract-equality/1","normative_anchor":"#terminal-contract-equality-1","semantic_status":"FROZEN"},
      {"derivation_id":"training-row-manifest-equality/1","normative_anchor":"#training-row-manifest-equality-1","semantic_status":"FROZEN"},
      {"derivation_id":"truth-block-pair-precedence/1","normative_anchor":"#truth-block-pair-precedence-1","semantic_status":"FROZEN"},
      {"derivation_id":"truth-scoring-mode/1","normative_anchor":"#truth-scoring-mode-1","semantic_status":"FROZEN"},
      {"derivation_id":"truth-target-pair-precedence/1","normative_anchor":"#truth-target-pair-precedence-1","semantic_status":"FROZEN"},
      {"derivation_id":"truth-targeted-tail-entropy-delta/1","normative_anchor":"#truth-targeted-tail-entropy-delta-1","semantic_status":"FROZEN"},
      {"derivation_id":"visible-terminal-flag/1","normative_anchor":"#visible-terminal-flag-1","semantic_status":"FROZEN"}
    ]
  },
  "family_order": [
    "easy_known_truth", "moderate_mina_shape", "small_sample", "noise_ladder", "weak_pre_post_separation",
    "incomplete_time_coverage", "tightly_spaced_events", "slow_overlapping_transitions", "outlier_sabotage",
    "mcar_missingness", "mar_missingness", "correlated_duplicate_events", "minority_alternate_sequence",
    "opposing_sequences_50_50", "near_simultaneous_events", "covariate_confounding", "group_boundary_sensitivity",
    "control_contamination", "heavy_tailed_skewed", "wrong_event_direction", "pure_no_signal",
    "label_permutation_null", "within_group_feature_permutation_null"
  ],
  "applicability_states": ["AVAILABLE", "UNAVAILABLE", "NOT_APPLICABLE", "INVALID", "FAILED"],
  "owner_classes": [
    {"owner_class":"PUBLIC_BATCH_CASE_PLAN","schema_ref":"schemas/evaluator-receipts.schema.json#/$defs/PublicBatchCasePlan","natural_identity_fields":["benchmark_subject_digest","authenticated_batch_sha256","case_ordinal","case_id"]},
    {"owner_class":"SYNTHETIC_TRUTH","schema_ref":"schemas/synthetic-truth.schema.json","natural_identity_fields":["truth_object_sha256"]},
    {"owner_class":"SYNTHETIC_SCIENTIFIC_DATA","schema_ref":"schemas/synthetic-scientific-data.schema.json","natural_identity_fields":["case_id","generated_scientific_data_sha256"]},